id,question_orig,opa_orig,opb_orig,opc_orig,opd_orig,cop_orig,choice_type_orig,exp_orig,subject_name_orig,topic_name_orig,found_keywords_orig,local_id_orig,,question_g2b,opa_g2b,opb_g2b,opc_g2b,opd_g2b,cop_g2b,choice_type_g2b,exp_g2b,subject_name_g2b,topic_name_g2b,found_keywords_g2b,local_id_g2b,,keep/drop,comments
b49b46c6-90e3-4791-84fb-4b79854888d5,Nonselective a + 1 blocker is ?,Carvedilol,Timolol,Pindolol,Acebutolol,-1,single,,Pharmacology,,['acebutolol' 'carvedilol' 'timolol' 'pindolol'],5119,,Nonselective a + 1 blocker is ?,coreg,blocadren,visken,sectral,-1,single,,Pharmacology,,['acebutolol' 'carvedilol' 'timolol' 'pindolol'],5119,,keep,
b4b951e1-33e3-45cc-b825-924502d73594,All of the following retards the orthodontic tooth movement except:,COX1 inhibitors,COX2 inhibitors,Ibuprofen,Aspirin,-1,multi,,Dental,,['ibuprofen'],5428,,All of the following retards the orthodontic tooth movement except:,COX1 inhibitors,COX2 inhibitors,advil,Aspirin,-1,multi,,Dental,,['ibuprofen'],5428,,keep,
b4bb15bb-2160-466d-87b0-15f7d9f7eaae,Dose of epinephrine given for anaphylaxis:,0.5mg 1: 1000 sc,0.5mg 1: l 00000 iv,0.5mg 1: 1000 iv,0.5mg 1:100000 SC,-1,single,,Pharmacology,,['epinephrine'],3189,,Dose of epipen given for anaphylaxis:,0.5mg 1: 1000 sc,0.5mg 1: l 00000 iv,0.5mg 1: 1000 iv,0.5mg 1:100000 SC,-1,single,,Pharmacology,,['epinephrine'],3189,,keep,
b4c23493-f5d0-45ff-ad4e-aa2c08cea69b,Which of the following is true about ziprasidone?,Profound extrapyramidal symptoms,Causes weight loss,Has anti - depressant propeies,Safe in cardiac patients.,-1,multi,,Pharmacology,,['ziprasidone'],1820,,Which of the following is true about geodon?,Profound extrapyramidal symptoms,Causes weight loss,Has anti - depressant propeies,Safe in cardiac patients.,-1,multi,,Pharmacology,,['ziprasidone'],1820,,keep,
b501b0de-72dd-4c61-9334-93fb58eb6bb5,"True statement regarding the relationship of somatostatin, insulin and glucagon is–",Somatostatin stimulates insulin release,Insulin stimulates somatostain and glucagon release,Glucagon inhibits insulin release,Somatostatin inhibits insulin and glucagon release,-1,multi,,Unknown,,['glucagon'],5712,,"True statement regarding the relationship of somatostatin, insulin and glucagen is–",Somatostatin stimulates insulin release,Insulin stimulates somatostain and glucagen release,glucagen inhibits insulin release,Somatostatin inhibits insulin and glucagen release,-1,multi,,Unknown,,['glucagon'],5712,,drop,
b555cd4f-ff0a-46df-ab71-f1616b2ed788,Drug used in vancomycin resistant staphylococcus aureus is?,Clindamycin,Linezolid,Daptomycin,Teicoplanin,-1,single,,Pharmacology,,['linezolid' 'vancomycin' 'clindamycin' 'daptomycin' 'teicoplanin'],3751,,Drug used in firvanq resistant staphylococcus aureus is?,cleocin,zyvox,cubicin,targocid,-1,single,,Pharmacology,,['linezolid' 'vancomycin' 'clindamycin' 'daptomycin' 'teicoplanin'],3751,,keep,
b678dfa7-0346-4039-8eca-281cd500b5bb,Guidewire-induced spasm of the distal superficial femoral artery is best treated with:,Nitroglycerine,Tolazoline,Papaverine,Ethanol,-1,single,,Unknown,,['papaverine'],5573,,Guidewire-induced spasm of the distal superficial femoral artery is best treated with:,Nitroglycerine,Tolazoline,papacon,Ethanol,-1,single,,Unknown,,['papaverine'],5573,,keep,
b7c6cd26-b4fd-49bc-a389-5077865beeaf,Which of these is a noradrenergic and specific serotonergic antidepressant (NaSSA)?,Duloxitine,Tianeptine,Duberoxitine,Mirtazapine,-1,single,,Pharmacology,,['mirtazapine'],305,,Which of these is a noradrenergic and specific serotonergic antidepressant (NaSSA)?,Duloxitine,Tianeptine,Duberoxitine,remeron,-1,single,,Pharmacology,,['mirtazapine'],305,,keep,
b82a9206-0a5c-48d2-8e9f-a80be5fefa89,Drug causing abruption placenta ?,Methadone,Cocaine,Amphetamine,Fluoxetine,-1,single,,Gynaecology & Obstetrics,,['fluoxetine' 'methadone'],4276,,Drug causing abruption placenta ?,dolophine,Cocaine,Amphetamine,prozac,-1,single,,Gynaecology & Obstetrics,,['fluoxetine' 'methadone'],4276,,keep,
b84e9c59-6304-41d0-98d3-503d512b11f6,Avidin has affinity for ?,Folic acid,Thiamine,Biotin,Riboflavin,-1,single,,Social & Preventive Medicine,,['biotin'],255,,Avidin has affinity for ?,Folic acid,Thiamine,appearex,Riboflavin,-1,single,,Social & Preventive Medicine,,['biotin'],255,,drop,
b869837e-2203-464c-9da5-3550a162d834,Clozapine is used for?,Resistant schizophrenia,Akathesia,First drug to be used for schizpophrenia,Used for schizophrenia with depression,-1,single,,Unknown,,['clozapine'],1369,,clozaril is used for?,Resistant schizophrenia,Akathesia,First drug to be used for schizpophrenia,Used for schizophrenia with depression,-1,single,,Unknown,,['clozapine'],1369,,keep,
b90aedf1-106d-4786-9d22-75bcd0181cec,Mechanism of action of Teriparatide is ?,Recombinant PTH,Recombinant calcitonin,Recombinant insulin,Recombinant prolactin,-1,single,,Pharmacology,,['teriparatide'],5341,,Mechanism of action of forteo is ?,Recombinant PTH,Recombinant calcitonin,Recombinant insulin,Recombinant prolactin,-1,single,,Pharmacology,,['teriparatide'],5341,,keep,
b9734079-cbed-4f2b-9564-42ff8fc6a50a,"At a high altitude of 3000 m, a person complains of breathlessness. All of the following can be used for the management of this person except?",Intravenous digoxin,Oxygen supplementation,Immediate descent,Acetazolamide,-1,multi,,Pharmacology,,['digoxin' 'acetazolamide'],6143,,"At a high altitude of 3000 m, a person complains of breathlessness. All of the following can be used for the management of this person except?",Intravenous lanoxin,Oxygen supplementation,Immediate descent,diamox,-1,multi,,Pharmacology,,['digoxin' 'acetazolamide'],6143,,keep,
b9c46d97-722d-430b-9568-a933a3a86b55,‘Peliosis heapatis’ is associated with all of the following except–,NSAIDs,Oral contraceptivepills,Androgens,Danazol,-1,multi,,Unknown,,['danazol'],3296,,‘Peliosis heapatis’ is associated with all of the following except–,NSAIDs,Oral contraceptivepills,Androgens,danocrine,-1,multi,,Unknown,,['danazol'],3296,,keep,
ba396dee-701c-4c9d-90fe-5589e29a30a5,"In a heart patient with replaced valves, a periodontal surgery is planned only for gingival tissue then:",No need of antibiotic,Should not be planned,Antibiotic coverage is required,0.2% chlorhexidine mouth wash is sufficient,-1,single,,Dental,,['chlorhexidine'],1351,,"In a heart patient with replaced valves, a periodontal surgery is planned only for gingival tissue then:",No need of antibiotic,Should not be planned,Antibiotic coverage is required,0.2% chloraprep mouth wash is sufficient,-1,single,,Dental,,['chlorhexidine'],1351,,drop,
ba6ea5aa-8a95-4974-8f90-7dd8f8d2bddf,Decreased fetal hea sound is due to which drug -,Oxytocin,Sodium bicarbonate,IV fluids,Iron,-1,single,,Gynaecology & Obstetrics,,['oxytocin'],5635,,Decreased fetal hea sound is due to which drug -,oxoject,Sodium bicarbonate,IV fluids,Iron,-1,single,,Gynaecology & Obstetrics,,['oxytocin'],5635,,keep,
ba76d205-72c2-426d-bc0e-1a2dab882a8b,Antiboiotic of choice for severe pneumonia in 1 year all child?,Cotrimoxazole,Ciprofloxacin,Benzyl penicillin,Tetracycline,-1,multi,,Social & Preventive Medicine,,['tetracycline' 'ciprofloxacin'],391,,Antiboiotic of choice for severe pneumonia in 1 year all child?,Cotrimoxazole,proquin,Benzyl penicillin,panmycin,-1,multi,,Social & Preventive Medicine,,['tetracycline' 'ciprofloxacin'],391,,keep,
bad50096-3d82-457c-8b8e-36dd95a0f200,Abraxane is a :?,Albumin bound docetaxel,Globulin bound docetaxel,Albumin bound paclitaxel,Globulin bound paclitaxel,-1,single,,Pharmacology,,['docetaxel' 'paclitaxel'],5571,,Abraxane is a :?,Albumin bound taxotere,Globulin bound taxotere,Albumin bound taxol,Globulin bound taxol,-1,single,,Pharmacology,,['docetaxel' 'paclitaxel'],5571,,keep,
bae5f866-36e1-4c8a-8ae7-fcf6b15a6367,Immediate metabolic products during conversion of Fructus 1-6 bisphosphate to 2 molecules of pyruvate -,"Glyceraldehyde-3-phosphate and 1,3-bisphosphoglycerate","Dihydroxyacetone phosphate and 1,3 bisphosphoglycerate",Glyceraldehyde-3-phosphate and dihydroxy-acetone phosphate,"3-phosphoglycerate and 1,3 bisphosglycerate",-1,single,,Biochemistry,,['dihydroxyacetone'],3544,,Immediate metabolic products during conversion of Fructus 1-6 bisphosphate to 2 molecules of pyruvate -,"Glyceraldehyde-3-phosphate and 1,3-bisphosphoglycerate","vitadye phosphate and 1,3 bisphosphoglycerate",Glyceraldehyde-3-phosphate and dihydroxy-acetone phosphate,"3-phosphoglycerate and 1,3 bisphosglycerate",-1,single,,Biochemistry,,['dihydroxyacetone'],3544,,keep,
bb52ab9d-5cec-4720-a397-7d893301b92f,Which of following is an analouge guanosine ?,Abacavir,Allopurinol,Bromodeoxyuridine,None,-1,multi,,Biochemistry,,['allopurinol'],1378,,Which of following is an analouge guanosine ?,Abacavir,caplenal,Bromodeoxyuridine,None,-1,multi,,Biochemistry,,['allopurinol'],1378,,keep,
bbefd23d-d381-4a76-849e-badf9a4adb7e,Misoprostol is which prostaglandin analog?,PGE1,PGE2,PGI2,PGF2α,-1,single,,Unknown,,['misoprostol'],2035,,cytotec is which prostaglandin analog?,PGE1,PGE2,PGI2,PGF2α,-1,single,,Unknown,,['misoprostol'],2035,,keep,
bc47eb14-5b7e-46e9-b258-45bd968c2aa0,Which of the following is not excreted in kidney ?,Ciprofloxacin,Ofloxacin,Levofloxacin,Moxifloxacin,-1,single,,Pharmacology,,['levofloxacin' 'moxifloxacin' 'ciprofloxacin' 'ofloxacin'],5965,,Which of the following is not excreted in kidney ?,proquin,floxin,levaquin,avelox,-1,single,,Pharmacology,,['levofloxacin' 'moxifloxacin' 'ciprofloxacin' 'ofloxacin'],5965,,keep,
bedb935a-e522-4d74-abd9-125b7aed624b,Anticraving drug used for both smoking and alcohol cessation is?,Topiramate,Levitracetam,Varnecilline,Naltrexone,-1,multi,,Unknown,,['topiramate' 'naltrexone'],3250,,Anticraving drug used for both smoking and alcohol cessation is?,topamax,Levitracetam,Varnecilline,revia,-1,multi,,Unknown,,['topiramate' 'naltrexone'],3250,,keep,
bedcdbd2-0c20-4755-9a7c-ecf0c5fb8c8c,All are true about constriction ring except ?,Also called schroeder's ring,Can be caused by injudicious oxytocin use,Ring can be palpated per abdomen,Inhalation of amyl nitrate relaxes the ring,-1,multi,,Gynaecology & Obstetrics,,['oxytocin'],3027,,All are true about constriction ring except ?,Also called schroeder's ring,Can be caused by injudicious oxoject use,Ring can be palpated per abdomen,Inhalation of amyl nitrate relaxes the ring,-1,multi,,Gynaecology & Obstetrics,,['oxytocin'],3027,,keep,
bf47eac3-c05c-4fbd-816a-6082115c07e0,Most potent opioid is ?,Butorphanol,Pentazocine,Sulfentanyl,Hdrocodone,-1,single,,Pharmacology,,['pentazocine' 'butorphanol'],4052,,Most potent opioid is ?,stadol,talwin,Sulfentanyl,Hdrocodone,-1,single,,Pharmacology,,['pentazocine' 'butorphanol'],4052,,keep,
bf602ae4-eed2-4960-aac0-ead8ab9ae220,A pregnant lady in the 3rd trimester is visiting a chloroquine-resistant malaria endemic area. Which drug can be used as prophylaxis for her?,Mefloquine,Doxycycline,Atovaquone/Proguanil,Primaquine,-1,single,,Unknown,,['mefloquine' 'doxycycline' 'chloroquine'],5913,,A pregnant lady in the 3rd trimester is visiting a resochin-resistant malaria endemic area. Which drug can be used as prophylaxis for her?,lariam,vibramycin,Atovaquone/Proguanil,Primaquine,-1,single,,Unknown,,['mefloquine' 'doxycycline' 'chloroquine'],5913,,keep,
bfdd8412-2b68-43bf-b2ca-8a087e4d0227,Q-T elongation is seen in which drug?,Quinidine,Amiodarone,Magnesium Sulfate,Lignocaine,-1,single,,Pharmacology,,['amiodarone' 'quinidine'],4255,,Q-T elongation is seen in which drug?,quinora,cordarone,Magnesium Sulfate,Lignocaine,-1,single,,Pharmacology,,['amiodarone' 'quinidine'],4255,,keep,
bff266bd-6377-4630-ab5c-96536dff9667,Acute myocarditis schintigraphy is done with -,Thallium,Technetium,Gallium,None,-1,multi,,Radiology,,['gallium'],2934,,Acute myocarditis schintigraphy is done with -,Thallium,Technetium,ganite,None,-1,multi,,Radiology,,['gallium'],2934,,keep,
c014197c-ce22-4fdc-96a9-97baf395245d,Which one of the following drug is not used for medical management of ectopic pregnancy?,KCl,Methotrexate,Actinomycin D,Misoprostol,-1,single,,Unknown,,['methotrexate' 'misoprostol'],5335,,Which one of the following drug is not used for medical management of ectopic pregnancy?,KCl,trexall,Actinomycin D,cytotec,-1,single,,Unknown,,['methotrexate' 'misoprostol'],5335,,keep,
c0ab321e-7a6c-4ec7-963e-c499e092622d,Atropine is not an antidote for?,Mushroom poisoning,Dhatura poisoning,Organophosphates poisoning,Carbamates poisoning,-1,single,,Unknown,,['atropine'],3939,,atropen is not an antidote for?,Mushroom poisoning,Dhatura poisoning,Organophosphates poisoning,Carbamates poisoning,-1,single,,Unknown,,['atropine'],3939,,keep,
c2b6ecd7-590b-4618-be41-f0fcedfdf9b7,Colchicine–,is a analgesic anti-inflammatory drug,inhibits the synthesis of uricacid,has uricosuric action,none of these,-1,multi,,Unknown,,['colchicine'],2484,,colcrys–,is a analgesic anti-inflammatory drug,inhibits the synthesis of uricacid,has uricosuric action,none of these,-1,multi,,Unknown,,['colchicine'],2484,,keep,
c319c488-b15f-480a-bc39-a05e50dab365,The statement that is NOT true of domperiodone is that,it rarely causes extrapyramidal side effects,it is a D₂ receptor antagonist,its antiemetic efficacy is higher than metoclopramide,it causes loose stool,-1,multi,,Unknown,,['metoclopramide'],1884,,The statement that is NOT true of domperiodone is that,it rarely causes extrapyramidal side effects,it is a D₂ receptor antagonist,its antiemetic efficacy is higher than reglan,it causes loose stool,-1,multi,,Unknown,,['metoclopramide'],1884,,keep,
c362eb45-0af6-42e0-8bb1-09c40f4a766d,Hormone responsible for galactopoiesis ?,Growth hormone,Insulin,Oxytocin,Prolactin,-1,single,,Physiology,,['oxytocin'],3909,,Hormone responsible for galactopoiesis ?,Growth hormone,Insulin,oxoject,Prolactin,-1,single,,Physiology,,['oxytocin'],3909,,drop,
c4481dd3-dc15-42dc-9199-39d112728273,Metronidazole+ciprofloxacin is effective against:,A.A.comitans,Porphyromas,Spirochaetes,All of the above,-1,multi,,Dental,,['metronidazole' 'ciprofloxacin'],2090,,flagyl+proquin is effective against:,A.A.comitans,Porphyromas,Spirochaetes,All of the above,-1,multi,,Dental,,['metronidazole' 'ciprofloxacin'],2090,,keep,
c47ccc0c-e5bb-4043-99a5-4e98b657b608,"In a patient of trench mouth, interproximal architecture has been lost, and having history of smoking, the
 antibiotic or combination required to treat this is:",Penicilline + Metronidazole,Cephalosporins,Norfioxacin,Sulfamethoxazole,-1,single,,Dental,,['metronidazole'],4272,,"In a patient of trench mouth, interproximal architecture has been lost, and having history of smoking, the
 antibiotic or combination required to treat this is:",Penicilline + flagyl,Cephalosporins,Norfioxacin,Sulfamethoxazole,-1,single,,Dental,,['metronidazole'],4272,,keep,
c50916df-f176-4467-a559-897ac94b0e02,Capecitabine belongs to which class of anticancer drug?,Antimetabolite,Alkylating agent,Nitrogen mustards,Vinca alkaloids,-1,single,,Pharmacology,,['capecitabine'],3297,,xeloda belongs to which class of anticancer drug?,Antimetabolite,Alkylating agent,Nitrogen mustards,Vinca alkaloids,-1,single,,Pharmacology,,['capecitabine'],3297,,keep,
c7ce522f-b5c3-48b3-8cb8-83fc1f87d5f4,Tamoxifen decreases the risk of which cancer?,Breast,Endometrium,Ovary,All of the above,-1,multi,,Gynaecology & Obstetrics,,['tamoxifen'],2575,,nolvadex decreases the risk of which cancer?,Breast,Endometrium,Ovary,All of the above,-1,multi,,Gynaecology & Obstetrics,,['tamoxifen'],2575,,keep,
c83fa54b-c9c4-4d52-8f90-cf47c75fbf91,Lorcaserin is used as ?,Anti-anxiety,Anti-smoking,Anti-helminthic,Anti-obesity,-1,single,,Pharmacology,,['lorcaserin'],988,,['belviq'] is used as ?,Anti-anxiety,Anti-smoking,Anti-helminthic,Anti-obesity,-1,single,,Pharmacology,,['lorcaserin'],988,,keep,
c9aac128-1cde-44c3-abd3-235f7c1e2859,Which of the following is a sympathomimetic ?,Propofol,Etomidate,Ketamine,N2O,-1,single,,Anaesthesia,,['etomidate' 'ketamine' 'propofol'],856,,Which of the following is a sympathomimetic ?,diprivan,amidate,ketalar,N2O,-1,single,,Anaesthesia,,['etomidate' 'ketamine' 'propofol'],856,,keep,
cac7cf24-e413-40d7-97ec-7e088747dfaf,Which of the following antidiabetic drug is insulin secretogogue ?,Pramlintide,Glucomannan,Exenatide,None,-1,multi,,Pharmacology,,['exenatide' 'pramlintide'],1075,,Which of the following antidiabetic drug is insulin secretogogue ?,symlin,Glucomannan,byetta,None,-1,multi,,Pharmacology,,['exenatide' 'pramlintide'],1075,,keep,
cc853241-b180-411e-a32e-4674f85cd64a,Drug used in microsphere is?,Minocycline,Tetracycline,Doxycycline,Metronidazole,-1,single,,Dental,,['metronidazole' 'tetracycline' 'minocycline' 'doxycycline'],4771,,Drug used in microsphere is?,minocin,panmycin,vibramycin,flagyl,-1,single,,Dental,,['metronidazole' 'tetracycline' 'minocycline' 'doxycycline'],4771,,keep,
cd48d96c-3f7b-42be-9a8f-44b846a96e51,Which of the following hormones interacts with a cytoplasmic receptor and then localizes in the nucleus and directs protein and nucleotide synthesis?,Thyrotropin - releasing hormone,Epinephrine,LH,Cortisol,-1,single,,Unknown,,['epinephrine'],6074,,Which of the following hormones interacts with a cytoplasmic receptor and then localizes in the nucleus and directs protein and nucleotide synthesis?,Thyrotropin - releasing hormone,epipen,LH,Cortisol,-1,single,,Unknown,,['epinephrine'],6074,,drop,
ce334274-19db-4a4e-9130-3c128d96bf93,The action of long acting muscle relaxants used during GA may be terminated by:,Neostigmine,Atropine,Ketamine,Succinylcholine,-1,single,,Surgery,,['ketamine' 'atropine' 'neostigmine'],4915,,The action of long acting muscle relaxants used during GA may be terminated by:,prostigmin,atropen,ketalar,Succinylcholine,-1,single,,Surgery,,['ketamine' 'atropine' 'neostigmine'],4915,,keep,
ce9429c7-3156-4e6f-9d15-4c8b7596bef8,Which drug can be given as substitute to Cyclosporine in person having drug induced gingival enlargement:,Tacrolimus.,Phenytoin.,Israpiridine.,All of the above.,-1,multi,,Dental,,['cyclosporine' 'tacrolimus' 'phenytoin'],2548,,Which drug can be given as substitute to restasis in person having drug induced gingival enlargement:,prograf.,dilantin.,Israpiridine.,All of the above.,-1,multi,,Dental,,['cyclosporine' 'tacrolimus' 'phenytoin'],2548,,keep,
ced1bd27-a119-4dc1-8fba-f055d0e1ba1b,Which of the following increases Amphoterecin B induced nephrotoxicity?,Vancomycin,Cyclosporin,Acyclovir,All the above,-1,multi,,Pharmacology,,['vancomycin'],3885,,Which of the following increases Amphoterecin B induced nephrotoxicity?,firvanq,Cyclosporin,Acyclovir,All the above,-1,multi,,Pharmacology,,['vancomycin'],3885,,keep,
cf85f797-514e-4bfc-82e1-4b99e9f2b7c7,Nocturnal enuresis best t/t is,Positive reinforcement,Punishment,Bed alarm,Desmopressin,-1,single,,Pediatrics,,['desmopressin'],356,,Nocturnal enuresis best t/t is,Positive reinforcement,Punishment,Bed alarm,stimate,-1,single,,Pediatrics,,['desmopressin'],356,,keep,
cfcdb18b-fdfc-4f74-9a3b-598ef86ddbd7,Maximum concentration for epidural block ?,Bupivacaine,Lidocaine,Ropivacaine,Chlorprocaine,-1,single,,Anaesthesia,,['lidocaine' 'ropivacaine' 'bupivacaine'],77,,Maximum concentration for epidural block ?,exparel,xylocaine,naropin,Chlorprocaine,-1,single,,Anaesthesia,,['lidocaine' 'ropivacaine' 'bupivacaine'],77,,keep,
d1a96447-8368-49aa-ae09-ff4e51929bd8,E. coli infection occur in which enzyme defect,Lactase,Pyruvate kinase,Pepsin,Trypsin,-1,single,,Microbiology,,['pepsin'],3439,,E. coli infection occur in which enzyme defect,Lactase,Pyruvate kinase,digipepsin,Trypsin,-1,single,,Microbiology,,['pepsin'],3439,,keep,
d22bbdc0-f91c-4f8d-81d1-ff58837d43cc,A multgravida 4 kg fetus is in labour since 15 hours and has 5cm dilation of cervix for last 8 hours. What is the fuher management of this patient ?,Wait and watch,Amniotomy,Injection Oxytocin,Caesarian section,-1,single,,Gynaecology & Obstetrics,,['oxytocin'],5040,,A multgravida 4 kg fetus is in labour since 15 hours and has 5cm dilation of cervix for last 8 hours. What is the fuher management of this patient ?,Wait and watch,Amniotomy,Injection oxoject,Caesarian section,-1,single,,Gynaecology & Obstetrics,,['oxytocin'],5040,,keep,
d2c6803a-1559-46a0-9c78-bd6eb46c3f80,Nasally acting GnRH analogue is ?,Goserelin,Triptorelin,Nafarelin,Leuprolide,-1,multi,,Pharmacology,,['triptorelin' 'goserelin' 'nafarelin'],1090,,Nasally acting GnRH analogue is ?,zoladex,trelstar,synarel,Leuprolide,-1,multi,,Pharmacology,,['triptorelin' 'goserelin' 'nafarelin'],1090,,keep,
d2d72bcc-7ab0-4298-8c39-c0f39edc6185,All are true about polycythemia vera except:,Increased ESR,Decreased erythropoietin,Increased LAP Score,Increased blood volume,-1,multi,,Unknown,,['erythropoietin'],3663,,All are true about polycythemia vera except:,Increased ESR,Decreased epogen,Increased LAP Score,Increased blood volume,-1,multi,,Unknown,,['erythropoietin'],3663,,drop,
d40c8d4b-12b6-49ae-b9d5-8e19698065d1,Maximum potassium loss is caused by which diuretics ?,Furosemide,Thiazide,Acetazolamide,Spironolactone,-1,single,,Pharmacology,,['spironolactone' 'furosemide' 'acetazolamide'],4800,,Maximum potassium loss is caused by which diuretics ?,lasix,Thiazide,diamox,carospir,-1,single,,Pharmacology,,['spironolactone' 'furosemide' 'acetazolamide'],4800,,keep,
d42f3519-605e-4ecd-808b-cb616ab74284,A 14 year old boy presents wit recurrent episodes of hepatitis Opthalmoscopic evalution reveals KF rings and serum ceruloplasmin levels are < 20 mg/dl.The treatment of choice for initial therapy is,Zinc,Penicillamine,Tetrathromolybdate,Hepatic transplantation,-1,single,,Medicine,,['penicillamine'],768,,A 14 year old boy presents wit recurrent episodes of hepatitis Opthalmoscopic evalution reveals KF rings and serum ceruloplasmin levels are < 20 mg/dl.The treatment of choice for initial therapy is,Zinc,cuprimine,Tetrathromolybdate,Hepatic transplantation,-1,single,,Medicine,,['penicillamine'],768,,keep,
d44dd67b-642d-4284-b85b-30e1ae5622e2,Not increased in stress ?,ADH,thyroxine,GH,None,-1,multi,,Physiology,,['thyroxine'],3412,,Not increased in stress ?,ADH,synthroid,GH,None,-1,multi,,Physiology,,['thyroxine'],3412,,drop,
d58a8e72-ae27-442b-a354-41a66e7faad0,Which of the following is not true regarding amoebic liver abscess,Multiple abscesses is more common,May rupture into the pleural cavity,For asymptomatic luminal carriers diloxanide furoate is the drug of choice,Mostly involving the right lobe of liver,-1,multi,,Microbiology,,['luminal'],2498,,Which of the following is not true regarding amoebic liver abscess,Multiple abscesses is more common,May rupture into the pleural cavity,For asymptomatic luminal carriers diloxanide furoate is the drug of choice,Mostly involving the right lobe of liver,-1,multi,,Microbiology,,['luminal'],2498,,drop,
d597b118-8fc6-4341-9578-2faefff2524d,Eye of tiger appearance is seen in -,Halle vorden Spatza,Suparanuclear palsy,Levodopa-responsive,All,-1,multi,,Radiology,,['levodopa'],3237,,Eye of tiger appearance is seen in -,Halle vorden Spatza,Suparanuclear palsy,dopar-responsive,All,-1,multi,,Radiology,,['levodopa'],3237,,keep,
d5a6a098-ccc2-42e8-bc1c-5fd3f23d8093,"Locally delivered, sustained-release form of minocycline microspheres for subgingival placement is?",Atridox,Periochip,Arestin,Perioscan,-1,multi,,Dental,,['minocycline'],4301,,"Locally delivered, sustained-release form of minocin microspheres for subgingival placement is?",Atridox,Periochip,Arestin,Perioscan,-1,multi,,Dental,,['minocycline'],4301,,drop,
d5ec16eb-5dbb-4a2a-b9fe-77f789a024e8,Edrophonium test is used in the diagnosis of?,Marcus gunn jaw winking ptosis,Horner's syndrome,Blepharophimosis syndrome,Myasthenic crisis,-1,single,,Pharmacology,,['edrophonium'],5350,,tensilon test is used in the diagnosis of?,Marcus gunn jaw winking ptosis,Horner's syndrome,Blepharophimosis syndrome,Myasthenic crisis,-1,single,,Pharmacology,,['edrophonium'],5350,,keep,
d6a70b6b-9e83-4859-9b73-6edc3950c7af,‘Coronary-steal phenomenon’ is caused by–,Dipyridamole,Diltiazem,Nitroglycerine,Verapamil,-1,single,,Unknown,,['diltiazem' 'verapamil'],5093,,‘Coronary-steal phenomenon’ is caused by–,Dipyridamole,angiozem,Nitroglycerine,isoptin,-1,single,,Unknown,,['diltiazem' 'verapamil'],5093,,keep,
d7530ea8-fae8-42b3-89f8-da4094295432,Hexokinase is inhibited by ?,Glucose-6-phosphate,Glucagon,Glucose,Insulin,-1,single,,Biochemistry,,['glucagon'],1706,,Hexokinase is inhibited by ?,Glucose-6-phosphate,glucagen,Glucose,Insulin,-1,single,,Biochemistry,,['glucagon'],1706,,drop,
d794bf4d-4b79-4559-afa7-aeeaaae16c90,Mechanism of action of ticagrelor ?,Cox inhibition,GPIIB/IIIAinhibition,Inhibition of thromboxane synthase,P2Y12 receptor antagonist,-1,single,,Pharmacology,,['ticagrelor'],2377,,Mechanism of action of brilinta ?,Cox inhibition,GPIIB/IIIAinhibition,Inhibition of thromboxane synthase,P2Y12 receptor antagonist,-1,single,,Pharmacology,,['ticagrelor'],2377,,keep,
d79714f1-dfb4-4d09-aa31-9a753a16d6e1,What is the effect of co administration of rifampicin and ritonavir in patients suffering from AIDS?,Area Under Curve decreased by 15%,Area Under Curve decreased by 35%,Area Under Curve increased by 15%,Area Under Curve increased by 35%,-1,single,,Pharmacology,,['ritonavir'],4098,,What is the effect of co administration of rifampicin and norvir in patients suffering from AIDS?,Area Under Curve decreased by 15%,Area Under Curve decreased by 35%,Area Under Curve increased by 15%,Area Under Curve increased by 35%,-1,single,,Pharmacology,,['ritonavir'],4098,,keep,
